Regional Manager ID,Regional Manager Name,Mail,Region,States Covered,Security
RMN7A3X1,Ashish Ramjuttun,AshishRamjuttun@islandguard.mu,North,"Rivière du Rempart, Flacq, Pamplemousses",Owner
RMS4B9K2,Céline Veerasamy,CelineVeerasamy@islandguard.mu,South,"Grand Port, Savanne, Mahebourg",User
RMW8C6P3,Sanjeev Pillay,SanjeevPillay@islandguard.mu,West,"Black River, Tamarin, Flic en Flac",User
RME2D5Q4,Nathalie Rughooputh,NathalieRughooputh@islandguard.mu,East,"Flacq, Centre de Flacq, Belle Mare",User
RMC9F7L5,Mohammed Issack,MohammedIssack@islandguard.mu,Central,"Moka, Plaines Wilhems, Beau Bassin-Rose Hill, Vacoas-Phoenix",Owner
